{
  "schema_version": "viralbench_acquisition_economics_v1",
  "generated_at": "2026-07-18T16:41:08Z",
  "program_id": "viralbench-acquisition-20260718",
  "status": "ready_with_locked_next_tranche",
  "scope_policy": {
    "internship_early_career_minimum_share": 0.7,
    "broader_job_search_maximum_share": 0.3,
    "discovery_seed_counts": {
      "total": 40,
      "internship_early_career": 28,
      "broader_job_search": 12
    },
    "post_acquisition_scope_mix_state": "unmeasured"
  },
  "compatibility": {
    "migration_style": "additive",
    "normalized_social_post_contract_unchanged": true,
    "viral_content_library_schema_2_readable": true,
    "prior_provider_ledger_readable": true
  },
  "spend_ledger": {
    "currency": "USD",
    "lifetime_program_ceiling_usd": 100,
    "tranche_size_usd": 25,
    "baseline": {
      "actual_reported_usd": 1.5555,
      "conservative_spend_usd": 18.681168,
      "settlement_state": "partially_settled_conservative_reserved"
    },
    "finalized_current_wave": {
      "apify_actual_reported_usd": 1.0934,
      "twelvelabs_actual_or_conservative_usd": 0.782054,
      "combined_actual_or_conservative_usd": 1.875454,
      "settlement_state": "apify_settled_twelvelabs_conservatively_estimated"
    },
    "cumulative": {
      "actual_reported_usd": 2.6489,
      "actual_reported_plus_provider_estimate_usd": 3.430954,
      "conservative_spend_usd": 20.556622,
      "first_tranche_remaining_usd": 4.443378,
      "settlement_state": "partially_settled_all_unknowns_conservatively_reserved"
    },
    "events": [
      {
        "event_id": "social-discovery-refresh",
        "provider": "Apify",
        "route_id": "social_discovery",
        "actual_reported_usd": 1.1622,
        "actual_or_conservative_usd": 3,
        "settlement_state": "settled",
        "source_path": "internship-reels-site/data/provider-spend-ledger.json"
      },
      {
        "event_id": "audience-comment-refresh",
        "provider": "Apify",
        "route_id": "audience_comment_research",
        "actual_reported_usd": 0.3393,
        "actual_or_conservative_usd": 4,
        "settlement_state": "settled",
        "source_path": "internship-reels-site/data/provider-spend-ledger.json"
      },
      {
        "event_id": "metric-recheck",
        "provider": "Apify",
        "route_id": "metric_rechecks",
        "actual_reported_usd": 0.054,
        "actual_or_conservative_usd": 2,
        "settlement_state": "settled",
        "source_path": "internship-reels-site/data/provider-spend-ledger.json"
      },
      {
        "event_id": "video-analysis-primary",
        "provider": "TwelveLabs",
        "route_id": "video_analysis",
        "actual_reported_usd": null,
        "actual_or_conservative_usd": 3.627389,
        "settlement_state": "conservatively_reserved",
        "source_path": "internship-reels-site/data/provider-spend-ledger.json"
      },
      {
        "event_id": "video-analysis-retry",
        "provider": "TwelveLabs",
        "route_id": "analysis_retries",
        "actual_reported_usd": null,
        "actual_or_conservative_usd": 1.541791,
        "settlement_state": "conservatively_reserved",
        "source_path": "internship-reels-site/data/provider-spend-ledger.json"
      },
      {
        "event_id": "video-analysis-reserve-recovery",
        "provider": "TwelveLabs",
        "route_id": "reserve",
        "actual_reported_usd": null,
        "actual_or_conservative_usd": 0.511988,
        "settlement_state": "conservatively_reserved",
        "source_path": "internship-reels-site/data/provider-spend-ledger.json"
      },
      {
        "event_id": "static-analysis-primary",
        "provider": "Gemini",
        "route_id": "static_analysis",
        "actual_reported_usd": null,
        "actual_or_conservative_usd": 3,
        "settlement_state": "conservatively_reserved",
        "source_path": "internship-reels-site/data/provider-spend-ledger.json"
      },
      {
        "event_id": "static-analysis-reserve-recovery",
        "provider": "Gemini",
        "route_id": "reserve",
        "actual_reported_usd": null,
        "actual_or_conservative_usd": 1,
        "settlement_state": "conservatively_reserved",
        "source_path": "internship-reels-site/data/provider-spend-ledger.json"
      },
      {
        "event_id": "authorized-wave-apify-20260718",
        "provider": "Apify",
        "route_id": "authorized-competitor-collection-waves-20260718",
        "actual_reported_usd": 1.0934,
        "actual_or_conservative_usd": 1.0934,
        "settlement_state": "settled",
        "source_path": ".semantic-artifacts/authorized-waves/wave-reconciliation-20260718.json"
      },
      {
        "event_id": "authorized-wave-twelvelabs-20260718",
        "provider": "TwelveLabs",
        "route_id": "authorized-competitor-analysis-waves-20260718",
        "actual_reported_usd": null,
        "actual_or_conservative_usd": 0.782054,
        "settlement_state": "actual_or_conservative",
        "source_path": ".semantic-artifacts/authorized-waves/wave-reconciliation-20260718.json"
      }
    ]
  },
  "route_scorecard": [
    {
      "route_id": "authorized-competitor-collection-waves-20260718",
      "route_kind": "acquisition",
      "returned_rows": 273,
      "relevant_rows": 220,
      "unique_rows": 220,
      "recent_timestamp_and_view_rows": 70,
      "metric_complete_rows": 220,
      "competitor_coverage_gained": 10,
      "analyzed_items": 15,
      "analysis_passed_items": 13,
      "temporal_rechecks_attempted": 0,
      "temporal_rechecks_with_usable_snapshot": 0,
      "actual_or_conservative_cost_usd": 1.0934,
      "cost_basis": "actual_reported",
      "accepted": true,
      "relevant_rows_per_dollar": 201.207243,
      "unique_rows_per_dollar": 201.207243,
      "cost_per_new_relevant_item_usd": 0.00497,
      "relevant_after_dedupe_rate": 0.805861,
      "duplicate_rate": 0.194139,
      "freshness_rate": 0.318182,
      "metric_completeness_rate": 1,
      "analysis_pass_rate": 0.866667,
      "temporal_recheck_yield": null
    },
    {
      "route_id": "authorized-competitor-analysis-waves-20260718",
      "route_kind": "analysis",
      "returned_rows": 15,
      "relevant_rows": 15,
      "unique_rows": 15,
      "recent_timestamp_and_view_rows": 15,
      "metric_complete_rows": 15,
      "competitor_coverage_gained": 13,
      "analyzed_items": 15,
      "analysis_passed_items": 13,
      "temporal_rechecks_attempted": 0,
      "temporal_rechecks_with_usable_snapshot": 0,
      "actual_or_conservative_cost_usd": 0.782054,
      "cost_basis": "actual_or_conservative",
      "accepted": true,
      "relevant_rows_per_dollar": 19.180261,
      "unique_rows_per_dollar": 19.180261,
      "cost_per_new_relevant_item_usd": 0.052137,
      "relevant_after_dedupe_rate": 1,
      "duplicate_rate": 0,
      "freshness_rate": 1,
      "metric_completeness_rate": 1,
      "analysis_pass_rate": 0.866667,
      "temporal_recheck_yield": null
    },
    {
      "route_id": "metric-recheck",
      "route_kind": "temporal_recheck",
      "returned_rows": 20,
      "relevant_rows": 20,
      "unique_rows": 20,
      "recent_timestamp_and_view_rows": 20,
      "metric_complete_rows": 20,
      "competitor_coverage_gained": 0,
      "analyzed_items": 0,
      "analysis_passed_items": 0,
      "temporal_rechecks_attempted": 20,
      "temporal_rechecks_with_usable_snapshot": 20,
      "actual_or_conservative_cost_usd": 0.054,
      "cost_basis": "actual_reported",
      "accepted": true,
      "relevant_rows_per_dollar": 370.37037,
      "unique_rows_per_dollar": 370.37037,
      "cost_per_new_relevant_item_usd": 0.0027,
      "relevant_after_dedupe_rate": 1,
      "duplicate_rate": 0,
      "freshness_rate": 1,
      "metric_completeness_rate": 1,
      "analysis_pass_rate": null,
      "temporal_recheck_yield": 1
    },
    {
      "route_id": "internship-discovery-acquisition-draft-v1-20260718",
      "route_kind": "draft_discovery",
      "returned_rows": 0,
      "relevant_rows": 0,
      "unique_rows": 0,
      "recent_timestamp_and_view_rows": 0,
      "metric_complete_rows": 0,
      "competitor_coverage_gained": 0,
      "analyzed_items": 0,
      "analysis_passed_items": 0,
      "temporal_rechecks_attempted": 0,
      "temporal_rechecks_with_usable_snapshot": 0,
      "actual_or_conservative_cost_usd": 0,
      "cost_basis": "zero_call_draft",
      "accepted": false,
      "relevant_rows_per_dollar": null,
      "unique_rows_per_dollar": null,
      "cost_per_new_relevant_item_usd": null,
      "relevant_after_dedupe_rate": null,
      "duplicate_rate": null,
      "freshness_rate": null,
      "metric_completeness_rate": null,
      "analysis_pass_rate": null,
      "temporal_recheck_yield": null
    }
  ],
  "tranche_gate": {
    "current_tranche": 1,
    "current_tranche_ceiling_usd": 25,
    "next_tranche": 2,
    "next_tranche_state": "locked",
    "gates": [
      {
        "gate_id": "deduplicated_relevance",
        "passed": true,
        "observed": 0.805861,
        "threshold": 0.2
      },
      {
        "gate_id": "recent_timestamp_and_view_candidates",
        "passed": true,
        "observed": 70,
        "threshold": 10
      },
      {
        "gate_id": "analysis_quality",
        "passed": true,
        "observed": 0.866667,
        "threshold": 0.8
      },
      {
        "gate_id": "spend_settled_or_conservatively_reserved",
        "passed": true,
        "observed": true,
        "threshold": true
      },
      {
        "gate_id": "cost_per_new_relevant",
        "passed": true,
        "observed": 0.00497,
        "threshold": 0.030992
      },
      {
        "gate_id": "internship_early_career_scope_mix",
        "passed": false,
        "observed": null,
        "threshold": 0.7
      }
    ],
    "stop_reasons": [],
    "allocation_caps": {
      "best_acquisition_route_usd": 12.5,